{
  "$schema": "./hunyuan-asset-generation-queue.v1.schema.json",
  "schemaVersion": 1,
  "queueId": "massfront-hunyuan-world-assets-v1",
  "createdDate": "2026-08-25",
  "status": "SOURCE_AUTHORING_QUEUE_ONLY",
  "runtimeReady": false,
  "sourceLibrary": {
    "index": "modules/space_exploration/assets/source/spline/prompt-guides/planet-expansion-32/index.json",
    "groupIndexes": [
      "modules/space_exploration/assets/source/spline/prompt-guides/planet-expansion-32/index-a.json",
      "modules/space_exploration/assets/source/spline/prompt-guides/planet-expansion-32/index-b.json",
      "modules/space_exploration/assets/source/spline/prompt-guides/planet-expansion-32/index-c.json"
    ],
    "planetCount": 32,
    "locationClasses": [
      "city_colony",
      "outpost",
      "military_base",
      "refinery",
      "relic_ruin",
      "spaceport",
      "pressure_dome",
      "derelict_megastructure"
    ],
    "referencePolicy": "Command & Conquer 3: Tiberium Wars, Supreme Commander 2, XCOM 2 and StarCraft II guide only broad readability, hierarchy, scale and pacing. Never copy or trace protected models, maps, materials, silhouettes, symbols, organisms, palettes or named landmarks; every source must remain original MASSFRONT work with provenance."
  },
  "coordinateContract": {
    "units": "meters",
    "upAxis": "+Y",
    "forwardAxis": "-Z",
    "detailSnapMeters": 4,
    "macroSnapMeters": 16,
    "smallVehicleGateMeters": [
      18,
      8
    ],
    "xsSmallInteriorAssemblyMeters": [
      96,
      96
    ]
  },
  "generationPolicy": {
    "provider": "hunyuan3d",
    "mode": "concept_image_to_3d",
    "oneSourceRootPerExport": true,
    "conceptFirst": true,
    "sourceRetention": true,
    "runtimeAdmission": "source_export_does_not_imply_runtime_ready",
    "originalityBoundary": "Generated concepts establish original MASSFRONT art direction only. Hunyuan source meshes must not reproduce protected designs, and exported source masters require topology, scale, UV, material, collision, LOD, mobile-capture and runtime review before any catalog admission.",
    "closeFinishedSplineTabs": true
  },
  "categoryTemplates": [
    {
      "assetCategory": "hero_building",
      "defaultEnvelopeMeters": {
        "x": 72,
        "y": 36,
        "z": 56
      },
      "minimumEnvelopeMeters": {
        "x": 32,
        "y": 12,
        "z": 24
      },
      "sourceTriangleCeiling": 450000,
      "packCompanions": [
        "lod1",
        "lod2",
        "collision_proxy",
        "destruction_proxy",
        "material_manifest"
      ]
    },
    {
      "assetCategory": "skyscraper",
      "defaultEnvelopeMeters": {
        "x": 32,
        "y": 72,
        "z": 32
      },
      "minimumEnvelopeMeters": {
        "x": 16,
        "y": 24,
        "z": 16
      },
      "sourceTriangleCeiling": 500000,
      "packCompanions": [
        "lod1",
        "lod2",
        "collision_proxy",
        "occupied_window_mask",
        "material_manifest"
      ]
    },
    {
      "assetCategory": "pressure_dome",
      "defaultEnvelopeMeters": {
        "x": 64,
        "y": 24,
        "z": 64
      },
      "minimumEnvelopeMeters": {
        "x": 32,
        "y": 12,
        "z": 32
      },
      "sourceTriangleCeiling": 450000,
      "packCompanions": [
        "lod1",
        "lod2",
        "collision_proxy",
        "pressure_portal_proxy",
        "material_manifest"
      ]
    },
    {
      "assetCategory": "world_detail",
      "defaultEnvelopeMeters": {
        "x": 24,
        "y": 18,
        "z": 24
      },
      "minimumEnvelopeMeters": {
        "x": 4,
        "y": 2,
        "z": 4
      },
      "sourceTriangleCeiling": 250000,
      "packCompanions": [
        "lod1",
        "lod2",
        "collision_proxy",
        "scatter_pivot_set",
        "material_manifest"
      ]
    },
    {
      "assetCategory": "brutish_enemy_structure",
      "defaultEnvelopeMeters": {
        "x": 56,
        "y": 32,
        "z": 56
      },
      "minimumEnvelopeMeters": {
        "x": 24,
        "y": 12,
        "z": 24
      },
      "sourceTriangleCeiling": 500000,
      "packCompanions": [
        "lod1",
        "lod2",
        "collision_proxy",
        "damage_state",
        "contact_material_mask"
      ]
    },
    {
      "assetCategory": "interior_xs_small_map_prop",
      "defaultEnvelopeMeters": {
        "x": 24,
        "y": 12,
        "z": 24
      },
      "minimumEnvelopeMeters": {
        "x": 16,
        "y": 4,
        "z": 16
      },
      "sourceTriangleCeiling": 350000,
      "packCompanions": [
        "lod1",
        "lod2",
        "collision_proxy",
        "cover_los_proxy",
        "roof_cutaway_group"
      ]
    }
  ],
  "planetProfiles": [
    {
      "order": 1,
      "planetId": "aelos",
      "displayName": "AELOS",
      "runtimeCanon": true,
      "sector": "sombrero_core",
      "factionContexts": [
        "nova_frontline"
      ],
      "biomeKey": "temperate_civic_ecumenopolis",
      "biome": "temperate civic ecumenopolis belts threaded through green river basins, working coastal yards and an arctic high shelf",
      "promptGuide": "modules/space_exploration/assets/source/spline/prompt-guides/planet-expansion-32/aelos.prompt.md",
      "firstWaveJobId": "hy3d_w1_aelos_skyscraper"
    },
    {
      "order": 2,
      "planetId": "elysion",
      "displayName": "ELYSION",
      "runtimeCanon": false,
      "sector": "sombrero_core",
      "factionContexts": [
        "uga_coalition"
      ],
      "biomeKey": "cloud_forest_mesas",
      "biome": "sunlit cloud-forest mesas and champagne-colored inland seas separated by white limestone escarpments",
      "promptGuide": "modules/space_exploration/assets/source/spline/prompt-guides/planet-expansion-32/elysion.prompt.md",
      "firstWaveJobId": "hy3d_w1_elysion_pressure_dome"
    },
    {
      "order": 3,
      "planetId": "thalassa",
      "displayName": "THALASSA",
      "runtimeCanon": false,
      "sector": "sombrero_core",
      "factionContexts": [
        "uga_coalition"
      ],
      "biomeKey": "ocean_archipelago",
      "biome": "global ocean broken by basalt archipelagos, floating kelp farms, abyssal trenches and storm-built reef shelves",
      "promptGuide": "modules/space_exploration/assets/source/spline/prompt-guides/planet-expansion-32/thalassa.prompt.md",
      "firstWaveJobId": "hy3d_w1_thalassa_hero_building"
    },
    {
      "order": 4,
      "planetId": "viridia",
      "displayName": "VIRIDIA",
      "runtimeCanon": false,
      "sector": "sombrero_core",
      "factionContexts": [
        "uga_coalition"
      ],
      "biomeKey": "luminous_fern_highlands",
      "biome": "humid emerald highlands beneath continent-scale fern canopies, quartz rivers and luminous mineral wetlands",
      "promptGuide": "modules/space_exploration/assets/source/spline/prompt-guides/planet-expansion-32/viridia.prompt.md",
      "firstWaveJobId": "hy3d_w1_viridia_skyscraper"
    },
    {
      "order": 5,
      "planetId": "pyraeth",
      "displayName": "PYRAETH",
      "runtimeCanon": true,
      "sector": "andromeda_forge",
      "factionContexts": [
        "crimson_dominion"
      ],
      "biomeKey": "storm_forge_calderas",
      "biome": "red-black crater courts, storm-scoured factory belts, caldera arcologies and exposed orbital flats",
      "promptGuide": "modules/space_exploration/assets/source/spline/prompt-guides/planet-expansion-32/pyraeth.prompt.md",
      "firstWaveJobId": "hy3d_w1_pyraeth_hero_building"
    },
    {
      "order": 6,
      "planetId": "ferrum",
      "displayName": "FERRUM",
      "runtimeCanon": false,
      "sector": "andromeda_forge",
      "factionContexts": [
        "syndicate"
      ],
      "biomeKey": "magnetite_desert",
      "biome": "iron-oxide deserts, magnetite mesas, nickel dunes and deep blue shadow canyons",
      "promptGuide": "modules/space_exploration/assets/source/spline/prompt-guides/planet-expansion-32/ferrum.prompt.md",
      "firstWaveJobId": "hy3d_w1_ferrum_world_detail"
    },
    {
      "order": 7,
      "planetId": "cinderfall",
      "displayName": "CINDERFALL",
      "runtimeCanon": false,
      "sector": "andromeda_forge",
      "factionContexts": [
        "crimson_dominion"
      ],
      "biomeKey": "volcanic_island_arc",
      "biome": "volcanic island arcs, obsidian deltas, ash forests and lava-cut black beaches under perpetual ember rain",
      "promptGuide": "modules/space_exploration/assets/source/spline/prompt-guides/planet-expansion-32/cinderfall.prompt.md",
      "firstWaveJobId": "hy3d_w1_cinderfall_hero_building"
    },
    {
      "order": 8,
      "planetId": "talos",
      "displayName": "TALOS",
      "runtimeCanon": false,
      "sector": "andromeda_forge",
      "factionContexts": [
        "uga_coalition"
      ],
      "biomeKey": "high_gravity_tablelands",
      "biome": "high-gravity basalt tablelands, cyclopean mountain stairs and dense silver grass valleys beneath a compressed sky",
      "promptGuide": "modules/space_exploration/assets/source/spline/prompt-guides/planet-expansion-32/talos.prompt.md",
      "firstWaveJobId": "hy3d_w1_talos_hero_building"
    },
    {
      "order": 9,
      "planetId": "nordhall",
      "displayName": "NORDHALL",
      "runtimeCanon": true,
      "sector": "orion_cryosphere",
      "factionContexts": [
        "syndicate"
      ],
      "biomeKey": "machine_cliff_cryosphere",
      "biome": "ice archipelagos, artillery-scarred machine cliffs, unstable reactor rifts and polar orbital-weather peaks",
      "promptGuide": "modules/space_exploration/assets/source/spline/prompt-guides/planet-expansion-32/nordhall.prompt.md",
      "firstWaveJobId": "hy3d_w1_nordhall_skyscraper"
    },
    {
      "order": 10,
      "planetId": "nacre",
      "displayName": "NACRE",
      "runtimeCanon": false,
      "sector": "orion_cryosphere",
      "factionContexts": [